{
  "$schema": "https://json-schema.org/draft/2020-12/schema",
  "$id": "https://vion.swiss/dale/topology.schema.json",
  "title": "Dale DevHost topology file (RFC 0006 R5)",
  "description": "The dev profile of a logic configuration: logic-block instances and explicit interface wiring, with contract mappings optional (unlisted contracts get DevHost mocks). The generic structural schema shipped with Vion.Dale.DevHost; 'dale dev --export-topology' writes a C#-built preset in this shape. Parsing is strict (unknown fields are rejected), so this schema catches wrong field names in hand edits.",
  "type": "object",
  "additionalProperties": false,
  "required": ["id", "logicBlockInstances"],
  "properties": {
    "$schema": { "type": "string" },
    "id": {
      "type": "string",
      "pattern": "^(?!.*\\.\\.)[A-Za-z0-9][A-Za-z0-9._-]*$",
      "not": { "pattern": "^[Ss][Cc][Hh][Ee][Mm][Aa]$" },
      "description": "URL-safe slug, no '..'; must match the file name (<id>.topology.json). 'schema' is reserved (GET /api/topologies/schema). Scenario files reference it via \"topology\"."
    },
    "logicBlockInstances": {
      "type": "array",
      "minItems": 1,
      "description": "The blocks in this topology; types are resolved against the loaded plugin assemblies.",
      "items": {
        "type": "object",
        "additionalProperties": false,
        "required": ["typeFullName", "name"],
        "properties": {
          "typeFullName": { "type": "string", "description": "Full type name of the LogicBlock (resolved from the loaded assemblies)." },
          "name": {
            "type": "string",
            "pattern": "^[^.]+$",
            "description": "Instance name, unique within the topology. No '.', which scenario name paths split on."
          },
          "instantiationParameters": {
            "type": "object",
            "description": "Operator-chosen [InstantiationParameter] values (identifier -> JSON scalar; enums as member-name strings), applied to the block before Configure so config-time inclusion gates resolve. Any JSON scalar the parameter's own declared type decodes, so a numeric parameter takes a fractional value. null is accepted only for a parameter whose declared type is nullable. Optional.",
            "additionalProperties": { "type": ["boolean", "number", "integer", "string", "null"] }
          }
        }
      }
    },
    "interfaceMappings": {
      "type": "array",
      "description": "Explicit logic-block interface wiring, applied verbatim (not re-discovered). Source and target names must be declared instances.",
      "items": {
        "type": "object",
        "additionalProperties": false,
        "required": ["sourceLogicBlockName", "sourceInterfaceIdentifier", "targetLogicBlockName", "targetInterfaceIdentifier"],
        "properties": {
          "sourceLogicBlockName": { "type": "string" },
          "sourceInterfaceIdentifier": { "type": "string" },
          "targetLogicBlockName": { "type": "string" },
          "targetInterfaceIdentifier": { "type": "string" }
        }
      }
    },
    "contractPairings": {
      "type": "array",
      "description": "RFC 0020: pairs of service-provider contract endpoints declared as ONE wire — each side's captured outbound is delivered as the other side's inbound, so a simulator block bound to a provider face closes the loop a real service provider would. Keyed on (block, contract binding), not on endpoint triples. Symmetric: which directions materialise is derived from the two handlers' [ScenarioWire] types and validated when the host loads the topology.",
      "items": {
        "type": "object",
        "additionalProperties": false,
        "required": ["a", "b"],
        "properties": {
          "a": { "$ref": "#/$defs/contractPairingEndpoint" },
          "b": { "$ref": "#/$defs/contractPairingEndpoint" }
        }
      }
    },
    "contractMappings": {
      "type": "array",
      "description": "Optional explicit hardware-contract endpoint mappings; unlisted contracts are auto-mocked. Field names match `dale dev --export-config` (the 'mapped' prefix), so the two shapes no longer diverge.",
      "items": {
        "type": "object",
        "additionalProperties": false,
        "required": ["logicBlockName", "contractIdentifier"],
        "properties": {
          "logicBlockName": { "type": "string" },
          "contractIdentifier": { "type": "string" },
          "mappedServiceProviderIdentifier": { "type": "string" },
          "mappedServiceIdentifier": { "type": "string" },
          "mappedContractIdentifier": { "type": "string" }
        }
      }
    }
  },
  "$defs": {
    "contractPairingEndpoint": {
      "type": "object",
      "additionalProperties": false,
      "required": ["logicBlockName", "contractIdentifier"],
      "properties": {
        "logicBlockName": { "type": "string", "description": "A declared instance name." },
        "contractIdentifier": { "type": "string", "description": "A service-provider contract binding on that instance." }
      }
    }
  }
}
