{
  "$schema": "./.dale/topology.schema.json",
  "id": "default",
  "logicBlockInstances": [
    {
      "typeFullName": "Vion.Examples.ToggleLight.LogicBlocks.Toggle",
      "name": "Toggle"
    },
    {
      "typeFullName": "Vion.Examples.ToggleLight.LogicBlocks.Light",
      "name": "Light"
    },
    {
      "typeFullName": "Vion.Examples.ToggleLight.LogicBlocks.IdealRelay",
      "name": "Relay"
    }
  ],
  "interfaceMappings": [
    {
      "sourceLogicBlockName": "Toggle",
      "sourceInterfaceIdentifier": "IToggler",
      "targetLogicBlockName": "Light",
      "targetInterfaceIdentifier": "IToggleable"
    }
  ],
  "contractPairings": [
    {
      "a": { "logicBlockName": "Light", "contractIdentifier": "DigitalOutput" },
      "b": { "logicBlockName": "Relay", "contractIdentifier": "LightChannel" }
    }
  ],
  "contractMappings": [
    {
      "logicBlockName": "Toggle",
      "contractIdentifier": "DigitalInput",
      "mappedServiceProviderIdentifier": "sp_lb_0",
      "mappedServiceIdentifier": "svc_lb_0",
      "mappedContractIdentifier": "DigitalInput"
    },
    {
      "logicBlockName": "Light",
      "contractIdentifier": "DigitalOutput",
      "mappedServiceProviderIdentifier": "sp_lb_1",
      "mappedServiceIdentifier": "svc_lb_1",
      "mappedContractIdentifier": "DigitalOutput"
    }
  ]
}
