{
  "$schema": "./.dale/topology.schema.json",
  "id": "default",
  "logicBlockInstances": [
    {
      "typeFullName": "Vion.Examples.Gating.LogicBlocks.ChargingStationBlock",
      "name": "Station",
      "instantiationParameters": { "ChargePointCount": 2, "Model": "Basic", "Region": "EU" }
    },
    {
      "typeFullName": "Vion.Examples.Gating.LogicBlocks.ChargeController",
      "name": "Controller"
    }
  ],
  "interfaceMappings": [
    {
      "sourceLogicBlockName": "Controller",
      "sourceInterfaceIdentifier": "IChargeController",
      "targetLogicBlockName": "Station",
      "targetInterfaceIdentifier": "Point1_IChargePoint"
    },
    {
      "sourceLogicBlockName": "Controller",
      "sourceInterfaceIdentifier": "IChargeController",
      "targetLogicBlockName": "Station",
      "targetInterfaceIdentifier": "Point2_IChargePoint"
    }
  ],
  "contractMappings": []
}
